question,answer_format,true_answer,false_answer_1,false_answer_2,false_answer_3,false_answer_4,false_answer_5
first_name‏,מה הוא השם הפרטי שלך?‏,לילך,ירדן‏,נופר‏,אלון‏,מתן‏,יהודה‏
surname‏,מה הוא שם המשפחה שלך?‏,אורנשטיין,טל‏,קליין‏,מרקוביץ‏,פינדיק‏,בן סימון‏
mother_name‏,מה הוא השם של אמא שלך?‏,סיגלית,סיון‏,דפנה‏,דבורה‏,ריבקה‏,עדי‏
birth_country‏,מה היא ארץ הלידה שלך?‏,ישראל,מולדובה‏,מצרים‏,קרואטיה‏,אוקראינה‏,יפן‏
birth_month‏,מה הוא חודש הלידה שלך?‏,אוקטובר,דצמבר‏,נובמבר‏,מרץ‏,פברואר‏,אוגוסט‏
